Enter password: ****
Welcome to the MySQL monitor.  Commands end with ; or \g.
Your MySQL connection id is 8
Server version: 8.0.31 MySQL Community Server - GPL

Copyright (c) 2000, 2022, Oracle and/or its affiliates.

Oracle is a registered trademark of Oracle Corporation and/or its
affiliates. Other names may be trademarks of their respective
owners.

Type 'help;' or '\h' for help. Type '\c' to clear the current input statement.

mysql> show databases;
+----------------------+
| Database             |
+----------------------+
| ant                  |
| college              |
| diff_company_details |
| information_schema   |
| institute            |
| jan_2023             |
| mysql                |
| myworld              |
| performance_schema   |
| python_p2            |
| sakila               |
| sys                  |
| world                |
| xyz                  |
+----------------------+
14 rows in set (0.03 sec)

mysql> connect diff_company_details;
Connection id:    9
Current database: diff_company_details

mysql> show tables;
+--------------------------------+
| Tables_in_diff_company_details |
+--------------------------------+
| a_company                      |
| ahinfotech                     |
| infotech                       |
+--------------------------------+
3 rows in set (0.01 sec)

mysql> select * from a_company;
+----------+--------+--------+----------+
| emp_name | emp_id | gender | location |
+----------+--------+--------+----------+
| A        |     11 | M      | banglr   |
| B        |     12 | M      | banglr   |
| A        |     13 | F      | Hyd      |
| Aa       |     14 | f      | Chennai  |
| c        |     17 | F      | Hyd      |
| C        |     10 | F      | Hyd      |
| D        |     21 | M      | Pune     |
| raj      |     22 | M      | banglr   |
| Saif     |     23 | M      | Hyd      |
| Sumit    |     35 | M      | Mp       |
| Reshma   |    101 | F      | Chennai  |
| Das      |     54 | M      | tpt      |
| Almn     |   1001 | M      | banglr   |
| sandip   |     81 | M      | banglr   |
| sree     |    111 | M      | tpt      |
| nani     |   1091 | M      | goa      |
| B        |     12 | M      | banglr   |
| B        |     12 | M      | banglr   |
| A        |     13 | F      | Hyd      |
| Aa       |     14 | f      | Chennai  |
| c        |     17 | F      | Hyd      |
| C        |     10 | F      | Hyd      |
| D        |     21 | M      | Pune     |
| raj      |     22 | M      | banglr   |
| Saif     |     23 | M      | Hyd      |
| Sumit    |     35 | M      | Mp       |
| Reshma   |    101 | F      | Chennai  |
| Das      |     54 | M      | tpt      |
| Almn     |   1001 | M      | banglr   |
| sandip   |     81 | M      | banglr   |
| sree     |    111 | M      | tpt      |
| sandip   |     81 | M      | banglr   |
+----------+--------+--------+----------+
32 rows in set (0.39 sec)

mysql> select count(*) from a_company;
+----------+
| count(*) |
+----------+
|       32 |
+----------+
1 row in set (0.05 sec)

mysql> select count(*) from ahinfotech;
+----------+
| count(*) |
+----------+
|       11 |
+----------+
1 row in set (0.40 sec)

mysql> select count(*) from infotech;
+----------+
| count(*) |
+----------+
|        4 |
+----------+
1 row in set (0.08 sec)

mysql> select * from ahinfotech;
+---------+------+------------+--------------+-----------+
| name    | id   | emp_gender | emp_location | address   |
+---------+------+------------+--------------+-----------+
| Ajay    |  151 | M          | banglr       | Marthalli |
| Arun    |  150 | M          | Hyd          | NULL      |
| Balu    |  157 | M          | Chennai      | NULL      |
| Anji    |  187 | M          | Hyd          | NULL      |
| Raju    |  200 | M          | Hyd          | NULL      |
| Dharani |  281 | F          | Pune         | NULL      |
| Saif    |  293 | M          | Hyd          | NULL      |
| Sumit   |  305 | M          | Mp           | NULL      |
| Das     |  548 | M          | tpt          | NULL      |
| Anil    |  111 | M          | tpt          | NULL      |
| Chitra  |  121 | M          | goa          | NULL      |
+---------+------+------------+--------------+-----------+
11 rows in set (0.00 sec)

mysql> select avg(id) from ahinfotech;
+----------+
| avg(id)  |
+----------+
| 227.6364 |
+----------+
1 row in set (0.38 sec)

mysql> select avg(name) from ahinfotech;
+-----------+
| avg(name) |
+-----------+
|         0 |
+-----------+
1 row in set, 11 warnings (0.39 sec)

mysql> select min(id) from ahinfotech;
+---------+
| min(id) |
+---------+
|     111 |
+---------+
1 row in set (0.00 sec)

mysql> select max(id) from ahinfotech;
+---------+
| max(id) |
+---------+
|     548 |
+---------+
1 row in set (0.00 sec)

mysql> select sum(id) from ahinfotech;
+---------+
| sum(id) |
+---------+
|    2504 |
+---------+
1 row in set (0.00 sec)

mysql> desc infotech;
+---------+-------------+------+-----+---------+-------+
| Field   | Type        | Null | Key | Default | Extra |
+---------+-------------+------+-----+---------+-------+
| id      | varchar(5)  | YES  |     | NULL    |       |
| name    | varchar(10) | YES  |     | NULL    |       |
| address | varchar(10) | YES  |     | NULL    |       |
+---------+-------------+------+-----+---------+-------+
3 rows in set (0.01 sec)

mysql> create table Tcs
    -> (name varchar(10));
Query OK, 0 rows affected (0.67 sec)

mysql> show tables;
+--------------------------------+
| Tables_in_diff_company_details |
+--------------------------------+
| a_company                      |
| ahinfotech                     |
| infotech                       |
| tcs                            |
+--------------------------------+
4 rows in set (0.00 sec)

mysql> drop tcs;
ERROR 1064 (42000): You have an error in your SQL syntax; check the manual that corresponds to your MySQL server version for the right syntax to use near 'tcs' at line 1
mysql> drop table tcs;
Query OK, 0 rows affected (0.16 sec)

mysql> show tables;
+--------------------------------+
| Tables_in_diff_company_details |
+--------------------------------+
| a_company                      |
| ahinfotech                     |
| infotech                       |
+--------------------------------+
3 rows in set (0.00 sec)

mysql> create table Tcs(
    -> name varchar(10)
    -> );
Query OK, 0 rows affected (0.44 sec)

mysql> show tables;
+--------------------------------+
| Tables_in_diff_company_details |
+--------------------------------+
| a_company                      |
| ahinfotech                     |
| infotech                       |
| tcs                            |
+--------------------------------+
4 rows in set (0.00 sec)

mysql> drop table tcs;
Query OK, 0 rows affected (0.22 sec)

mysql> create table tcs(id number,name varchar(10) notnull);
ERROR 1064 (42000): You have an error in your SQL syntax; check the manual that corresponds to your MySQL server version for the right syntax to use near 'number,name varchar(10) notnull)' at line 1
mysql> create table tcs(id integer,name varchar(10) not null);
Query OK, 0 rows affected (0.16 sec)

mysql> show tables;
+--------------------------------+
| Tables_in_diff_company_details |
+--------------------------------+
| a_company                      |
| ahinfotech                     |
| infotech                       |
| tcs                            |
+--------------------------------+
4 rows in set (0.00 sec)

mysql> desc tcs;
+-------+-------------+------+-----+---------+-------+
| Field | Type        | Null | Key | Default | Extra |
+-------+-------------+------+-----+---------+-------+
| id    | int         | YES  |     | NULL    |       |
| name  | varchar(10) | NO   |     | NULL    |       |
+-------+-------------+------+-----+---------+-------+
2 rows in set (0.01 sec)

mysql> insert into tcs(id,name) values(1,"kumar");
Query OK, 1 row affected (0.39 sec)

mysql> select * from tcs;
+------+-------+
| id   | name  |
+------+-------+
|    1 | kumar |
+------+-------+
1 row in set (0.00 sec)

mysql> insert into tcs(id,name) values(NULL,"Bharath");
Query OK, 1 row affected (0.38 sec)

mysql> select * from tcs;
+------+---------+
| id   | name    |
+------+---------+
|    1 | kumar   |
| NULL | Bharath |
+------+---------+
2 rows in set (0.00 sec)

mysql> insert into tcs(id,name) values(1,Null);
ERROR 1048 (23000): Column 'name' cannot be null
mysql> create table Sample(eid int , ename varchar(20) unique ,salary double);
Query OK, 0 rows affected (0.19 sec)

mysql> insert into sample(eid,ename,salary) values (101, "Tharun",20000);
Query OK, 1 row affected (0.10 sec)

mysql> select * from sample;
+------+--------+--------+
| eid  | ename  | salary |
+------+--------+--------+
|  101 | Tharun |  20000 |
+------+--------+--------+
1 row in set (0.00 sec)

mysql> select count(*) from sample;
+----------+
| count(*) |
+----------+
|        1 |
+----------+
1 row in set (0.00 sec)

mysql> insert into sample(eid,ename,salary) values (102, "AMAR",30000);
Query OK, 1 row affected (0.09 sec)

mysql> insert into sample(eid,ename,salary) values (103, "Riyaz",44000);
Query OK, 1 row affected (0.09 sec)

mysql> insert into sample(eid,ename,salary) values (103, "lokesh",55000);
Query OK, 1 row affected (0.09 sec)

mysql> insert into sample(eid,ename,salary) values (104, "lokesh",65000);
ERROR 1062 (23000): Duplicate entry 'lokesh' for key 'sample.ename'
mysql> insert into sample(eid,ename,salary) values (104, NULL,65000);
Query OK, 1 row affected (0.09 sec)

mysql> insert into sample(eid,ename,salary) values (104, NULL,65000);
Query OK, 1 row affected (0.09 sec)

mysql> insert into sample(eid,ename,salary) values (104, NULL,65000);
Query OK, 1 row affected (0.08 sec)

mysql> select * from sample;
+------+--------+--------+
| eid  | ename  | salary |
+------+--------+--------+
|  101 | Tharun |  20000 |
|  102 | AMAR   |  30000 |
|  103 | Riyaz  |  44000 |
|  103 | lokesh |  55000 |
|  104 | NULL   |  65000 |
|  104 | NULL   |  65000 |
|  104 | NULL   |  65000 |
+------+--------+--------+
7 rows in set (0.00 sec)

mysql> update table sample set ename="Manu" where salary=65000;
ERROR 1064 (42000): You have an error in your SQL syntax; check the manual that corresponds to your MySQL server version for the right syntax to use near 'table sample set ename="Manu" where salary=65000' at line 1
mysql> delete  from sample where eid = 104;
Query OK, 3 rows affected (0.37 sec)

mysql> insert into sample(eid,ename,salary) values (104, NULL,65000);
Query OK, 1 row affected (0.07 sec)

mysql> insert into sample(eid,ename,salary) values (105, NULL,65000);
Query OK, 1 row affected (0.09 sec)

mysql> select * from sample;
+------+--------+--------+
| eid  | ename  | salary |
+------+--------+--------+
|  101 | Tharun |  20000 |
|  102 | AMAR   |  30000 |
|  103 | Riyaz  |  44000 |
|  103 | lokesh |  55000 |
|  104 | NULL   |  65000 |
|  105 | NULL   |  65000 |
+------+--------+--------+
6 rows in set (0.00 sec)

mysql> update  sample set ename="Manu" where eid = 104;
Query OK, 1 row affected (0.08 sec)
Rows matched: 1  Changed: 1  Warnings: 0

mysql> select * from sample;
+------+--------+--------+
| eid  | ename  | salary |
+------+--------+--------+
|  101 | Tharun |  20000 |
|  102 | AMAR   |  30000 |
|  103 | Riyaz  |  44000 |
|  103 | lokesh |  55000 |
|  104 | Manu   |  65000 |
|  105 | NULL   |  65000 |
+------+--------+--------+
6 rows in set (0.00 sec)

mysql> alter table sample add column location varchar(10) default "MPL";
Query OK, 0 rows affected (0.11 sec)
Records: 0  Duplicates: 0  Warnings: 0

mysql> select * from sample;
+------+--------+--------+----------+
| eid  | ename  | salary | location |
+------+--------+--------+----------+
|  101 | Tharun |  20000 | MPL      |
|  102 | AMAR   |  30000 | MPL      |
|  103 | Riyaz  |  44000 | MPL      |
|  103 | lokesh |  55000 | MPL      |
|  104 | Manu   |  65000 | MPL      |
|  105 | NULL   |  65000 | MPL      |
+------+--------+--------+----------+
6 rows in set (0.00 sec)

mysql> insert into sample(eid,ename,salary,location) values (106.7,lakshmi,65000,"bangalore");
ERROR 1054 (42S22): Unknown column 'lakshmi' in 'field list'
mysql> insert into sample(eid,ename,salary,location) values (106.7,"lakshmi",65000,"bangalore");
Query OK, 1 row affected (0.07 sec)

mysql> select * from sample;
+------+---------+--------+-----------+
| eid  | ename   | salary | location  |
+------+---------+--------+-----------+
|  101 | Tharun  |  20000 | MPL       |
|  102 | AMAR    |  30000 | MPL       |
|  103 | Riyaz   |  44000 | MPL       |
|  103 | lokesh  |  55000 | MPL       |
|  104 | Manu    |  65000 | MPL       |
|  105 | NULL    |  65000 | MPL       |
|  107 | lakshmi |  65000 | bangalore |
+------+---------+--------+-----------+
7 rows in set (0.00 sec)

mysql> insert into sample(eid,ename,salary) values (106.7,"lakshmi",65000);
ERROR 1062 (23000): Duplicate entry 'lakshmi' for key 'sample.ename'
mysql> insert into sample(eid,ename,salary) values (106.7,"lakshmi_g",65000);
Query OK, 1 row affected (0.09 sec)

mysql> select * from sample;
+------+-----------+--------+-----------+
| eid  | ename     | salary | location  |
+------+-----------+--------+-----------+
|  101 | Tharun    |  20000 | MPL       |
|  102 | AMAR      |  30000 | MPL       |
|  103 | Riyaz     |  44000 | MPL       |
|  103 | lokesh    |  55000 | MPL       |
|  104 | Manu      |  65000 | MPL       |
|  105 | NULL      |  65000 | MPL       |
|  107 | lakshmi   |  65000 | bangalore |
|  107 | lakshmi_g |  65000 | MPL       |
+------+-----------+--------+-----------+
8 rows in set (0.00 sec)

mysql> create table covid_cases_wave_1(
    ->                                 id int not null auto_increment,
    ->                                 year int ,
    ->                                 positive bigint not null,
    ->                                 recovery bigint not null ,
    ->                                 dead int     not null,
    ->                                 primary key(id)
    ->                                 );
Query OK, 0 rows affected (0.19 sec)

mysql> select count(*) from covid_cases_wave_1;
+----------+
| count(*) |
+----------+
|        0 |
+----------+
1 row in set (0.00 sec)

mysql> insert into covid_cases_wave_1(id,year,positive,recovery,dead)
    ->           values (1,2020,100000,95000,5000);
Query OK, 1 row affected (0.14 sec)

mysql> insert into covid_cases_wave_1(year,positive,recovery,dead) values(2021,20000,19900,100);
Query OK, 1 row affected (0.09 sec)

mysql> select * from covid_cases_wave_1;
+----+------+----------+----------+------+
| id | year | positive | recovery | dead |
+----+------+----------+----------+------+
|  1 | 2020 |   100000 |    95000 | 5000 |
|  2 | 2021 |    20000 |    19900 |  100 |
+----+------+----------+----------+------+
2 rows in set (0.00 sec)

mysql> insert into covid_cases_wave_1(id,year,positive,recovery,dead) values(2,2021,20000,19900,100);
ERROR 1062 (23000): Duplicate entry '2' for key 'covid_cases_wave_1.PRIMARY'
mysql> insert into covid_cases_wave_1(id,year,positive,recovery,dead) values(NULL,2021,20000,19900,100);
Query OK, 1 row affected (0.28 sec)

mysql> select * from covid_cases_wave_1;
+----+------+----------+----------+------+
| id | year | positive | recovery | dead |
+----+------+----------+----------+------+
|  1 | 2020 |   100000 |    95000 | 5000 |
|  2 | 2021 |    20000 |    19900 |  100 |
|  3 | 2021 |    20000 |    19900 |  100 |
+----+------+----------+----------+------+
3 rows in set (0.00 sec)

mysql> insert into covid_cases_wave_1(id,year,positive,recovery,dead) values(100,2021,20000,19900,100);
Query OK, 1 row affected (0.05 sec)

mysql> select * from covid_cases_wave_1;
+-----+------+----------+----------+------+
| id  | year | positive | recovery | dead |
+-----+------+----------+----------+------+
|   1 | 2020 |   100000 |    95000 | 5000 |
|   2 | 2021 |    20000 |    19900 |  100 |
|   3 | 2021 |    20000 |    19900 |  100 |
| 100 | 2021 |    20000 |    19900 |  100 |
+-----+------+----------+----------+------+
4 rows in set (0.00 sec)

mysql> insert into covid_cases_wave_1(id,year,positive,recovery,dead) values(NULL,2021,20000,19900,100);
Query OK, 1 row affected (0.09 sec)

mysql> select * from covid_cases_wave_1;
+-----+------+----------+----------+------+
| id  | year | positive | recovery | dead |
+-----+------+----------+----------+------+
|   1 | 2020 |   100000 |    95000 | 5000 |
|   2 | 2021 |    20000 |    19900 |  100 |
|   3 | 2021 |    20000 |    19900 |  100 |
| 100 | 2021 |    20000 |    19900 |  100 |
| 101 | 2021 |    20000 |    19900 |  100 |
+-----+------+----------+----------+------+
5 rows in set (0.00 sec)

mysql> create table covid_details_in_AP(
    ->                                  id_1 int not null auto_increment,
    ->                                  all_cases bigint,
    ->                                  val_1 int,
    ->                                  recoverycases bigint,
    ->                                  death_cases bigint,
    ->                                  year int ,
    ->                                  primary key(id_1),
    ->                                  foreign key(val_1) references covid_cases_wave_1 (id)
    ->                                 );
Query OK, 0 rows affected (0.18 sec)

mysql> select * from covid_details_in_Ap;
Empty set (0.00 sec)

mysql> insert into covid_details_in_AP(all_cases,recoverycases,death_cases,year)values (100,98,2,2);
Query OK, 1 row affected (0.06 sec)

mysql> select * from covid_details_in_AP;insert into covid_details_in_AP(all_cases,recoverycases,death_cases,year)values (100,98,2,2);
+------+-----------+-------+---------------+-------------+------+
| id_1 | all_cases | val_1 | recoverycases | death_cases | year |
+------+-----------+-------+---------------+-------------+------+
|    1 |       100 |  NULL |            98 |           2 |    2 |
+------+-----------+-------+---------------+-------------+------+
1 row in set (0.00 sec)

Query OK, 1 row affected (0.03 sec)

mysql> insert into covid_details_in_AP(all_cases,recoverycases,death_cases,year)values (100,98,2,2);
Query OK, 1 row affected (0.09 sec)

mysql> select * from covid_details_in_AP;insert into covid_details_in_AP(all_cases,recoverycases,death_cases,year)values (100,98,2,2);
+------+-----------+-------+---------------+-------------+------+
| id_1 | all_cases | val_1 | recoverycases | death_cases | year |
+------+-----------+-------+---------------+-------------+------+
|    1 |       100 |  NULL |            98 |           2 |    2 |
|    2 |       100 |  NULL |            98 |           2 |    2 |
|    3 |       100 |  NULL |            98 |           2 |    2 |
+------+-----------+-------+---------------+-------------+------+
3 rows in set (0.00 sec)

Query OK, 1 row affected (0.09 sec)

mysql> insert into covid_details_in_AP(all_cases,recoverycases,death_cases,year)values (100,98,2,2);
Query OK, 1 row affected (0.09 sec)

mysql> insert into covid_details_in_AP(id_1,all_cases,val_1,recoverycases,deah_cases,year) values(150,1000,1,800,2,2020);
ERROR 1054 (42S22): Unknown column 'deah_cases' in 'field list'
mysql> insert into covid_details_in_AP(id_1,all_cases,val_1,recoverycases,death_cases,year) values(150,1000,1,800,2,2020);
Query OK, 1 row affected (0.09 sec)

mysql> select * from covid_details_in_AP;
+------+-----------+-------+---------------+-------------+------+
| id_1 | all_cases | val_1 | recoverycases | death_cases | year |
+------+-----------+-------+---------------+-------------+------+
|    1 |       100 |  NULL |            98 |           2 |    2 |
|    2 |       100 |  NULL |            98 |           2 |    2 |
|    3 |       100 |  NULL |            98 |           2 |    2 |
|    4 |       100 |  NULL |            98 |           2 |    2 |
|    5 |       100 |  NULL |            98 |           2 |    2 |
|  150 |      1000 |     1 |           800 |           2 | 2020 |
+------+-----------+-------+---------------+-------------+------+
6 rows in set (0.00 sec)

mysql> insert into covid_details_in_AP(id_1,all_cases,val_1,recoverycases,death_cases,year) values(150,1000,1000,800,2,2020);
ERROR 1062 (23000): Duplicate entry '150' for key 'covid_details_in_ap.PRIMARY'
mysql> insert into covid_details_in_AP(all_cases,val_1,recoverycases,death_cases,year) values(1000,1000,800,2,2020);
ERROR 1452 (23000): Cannot add or update a child row: a foreign key constraint fails (`diff_company_details`.`covid_details_in_ap`, CONSTRAINT `covid_details_in_ap_ibfk_1` FOREIGN KEY (`val_1`) REFERENCES `covid_cases_wave_1` (`id`))
mysql> insert into covid_details_in_AP(all_cases,val_1,recoverycases,death_cases,year) values(1000,2,800,2,2020);
Query OK, 1 row affected (0.38 sec)

mysql> insert into covid_details_in_AP(all_cases,val_1,recoverycases,death_cases,year) values(1000,3,800,2,2020);
Query OK, 1 row affected (0.09 sec)

mysql> insert into covid_details_in_AP(all_cases,val_1,recoverycases,death_cases,year) values(1000,100,800,2,2020);
Query OK, 1 row affected (0.09 sec)

mysql> insert into covid_details_in_AP(all_cases,val_1,recoverycases,death_cases,year) values(1000,3,800,2,2020);
Query OK, 1 row affected (0.08 sec)

mysql> select * from covid_details_in_AP;
+------+-----------+-------+---------------+-------------+------+
| id_1 | all_cases | val_1 | recoverycases | death_cases | year |
+------+-----------+-------+---------------+-------------+------+
|    1 |       100 |  NULL |            98 |           2 |    2 |
|    2 |       100 |  NULL |            98 |           2 |    2 |
|    3 |       100 |  NULL |            98 |           2 |    2 |
|    4 |       100 |  NULL |            98 |           2 |    2 |
|    5 |       100 |  NULL |            98 |           2 |    2 |
|  150 |      1000 |     1 |           800 |           2 | 2020 |
|  152 |      1000 |     2 |           800 |           2 | 2020 |
|  153 |      1000 |     3 |           800 |           2 | 2020 |
|  154 |      1000 |   100 |           800 |           2 | 2020 |
|  155 |      1000 |     3 |           800 |           2 | 2020 |
+------+-----------+-------+---------------+-------------+------+
10 rows in set (0.00 sec)


mysql> create table xyz(name char(10),age int);
Query OK, 0 rows affected (0.09 sec)

mysql> insert into xyz(name,age)values("ab",11);
Query OK, 1 row affected (0.09 sec)

mysql> insert into xyz(name,age)values("xy",12);
Query OK, 1 row affected (0.10 sec)

mysql> insert into xyz(name,age)values("lmn",2);
Query OK, 1 row affected (0.09 sec)

mysql> select * form xyz;
ERROR 1064 (42000): You have an error in your SQL syntax; check the manual that corresponds to your MySQL server version for the right syntax to use near 'form xyz' at line 1
mysql> select * from xyz;
+------+------+
| name | age  |
+------+------+
| ab   |   11 |
| xy   |   12 |
| lmn  |    2 |
+------+------+
3 rows in set (0.00 sec)

mysql> truncate table xyz;
Query OK, 0 rows affected (0.24 sec)

mysql> select * from xyz;
Empty set (0.00 sec)

mysql> desc xyz;
+-------+----------+------+-----+---------+-------+
| Field | Type     | Null | Key | Default | Extra |
+-------+----------+------+-----+---------+-------+
| name  | char(10) | YES  |     | NULL    |       |
| age   | int      | YES  |     | NULL    |       |
+-------+----------+------+-----+---------+-------+
2 rows in set (0.01 sec)

mysql> insert into xyz(name,age)values("lmn",2);
Query OK, 1 row affected (0.09 sec)

mysql> insert into xyz(name,age)values("ab",11);
Query OK, 1 row affected (0.09 sec)

mysql> insert into xyz(name,age)values("xy",12);
Query OK, 1 row affected (0.08 sec)

mysql> select * form xyz;
ERROR 1064 (42000): You have an error in your SQL syntax; check the manual that corresponds to your MySQL server version for the right syntax to use near 'form xyz' at line 1
mysql> select * from xyz;
+------+------+
| name | age  |
+------+------+
| lmn  |    2 |
| ab   |   11 |
| xy   |   12 |
+------+------+
3 rows in set (0.00 sec)

mysql> drop xyz;
ERROR 1064 (42000): You have an error in your SQL syntax; check the manual that corresponds to your MySQL server version for the right syntax to use near 'xyz' at line 1
mysql> drop table xyz;
Query OK, 0 rows affected (0.10 sec)

mysql> select * from xyz;
ERROR 1146 (42S02): Table 'diff_company_details.xyz' doesn't exist
mysql> show tables;
+--------------------------------+
| Tables_in_diff_company_details |
+--------------------------------+
| a_company                      |
| ahinfotech                     |
| covid_cases_wave_1             |
| covid_details_in_ap            |
| infotech                       |
| sample                         |
| tcs                            |
+--------------------------------+
7 rows in set (0.00 sec)

mysql> desc xyz;
ERROR 1146 (42S02): Table 'diff_company_details.xyz' doesn't exist
mysql>